{
  "$schema":"https://json-schema.org/draft/2020-12/schema",
  "$id":"bopen://schemas/governance/skill-register/0.1.0-draft",
  "status":"draft","title":"bOPEN Skill Register","type":"object",
  "required":["$schema","register_id","version","status","owner_authority","updated_at","entries"],
  "properties":{"$schema":{"const":"bopen://schemas/governance/skill-register/0.1.0-draft"},"register_id":{"type":"string","pattern":"^PG-REG-SKILL-[0-9]{3}$"},"version":{"type":"string","pattern":"^[0-9]+\\.[0-9]+\\.[0-9]+(?:-draft)?$"},"status":{"enum":["draft","approved"]},"owner_authority":{"type":"string","minLength":1},"updated_at":{"type":"string","format":"date-time"},"approved_by":{"type":["string","null"],"minLength":1},"approved_at":{"type":["string","null"],"format":"date-time"},"approval_ref":{"type":["string","null"],"minLength":1},"entries":{"type":"array","items":{"type":"object","required":["skill_id","version","name","owner_authority","status","source_provenance_ref","sandbox_evidence_ref","evaluation_evidence_ref","allowed_uses","prohibited_uses","promoted_by","promoted_at","review_due_at","expires_at"],"properties":{"skill_id":{"type":"string","pattern":"^SKILL-[A-Z0-9_-]+$"},"version":{"type":"string","minLength":1},"name":{"type":"string","minLength":1},"owner_authority":{"type":"string","minLength":1},"status":{"enum":["DRAFT","SANDBOXED","EVALUATED","ACTIVE","SUSPENDED","RETIRED"]},"source_provenance_ref":{"type":"string","minLength":1},"sandbox_evidence_ref":{"type":["string","null"]},"evaluation_evidence_ref":{"type":["string","null"]},"allowed_uses":{"type":"array","items":{"type":"string","minLength":1},"uniqueItems":true},"prohibited_uses":{"type":"array","items":{"type":"string","minLength":1},"uniqueItems":true},"promoted_by":{"type":["string","null"]},"promoted_at":{"type":["string","null"],"format":"date-time"},"review_due_at":{"type":["string","null"],"format":"date-time"},"expires_at":{"type":["string","null"],"format":"date-time"}},"additionalProperties":false}}},
  "additionalProperties":false
}
