{
  "$schema": "bopen://schemas/governance/skill-register/0.1.0-draft",
  "register_id": "PG-REG-SKILL-001",
  "version": "0.1.0",
  "status": "approved",
  "owner_authority": "Engineering Authority",
  "updated_at": "2026-07-23T00:45:00+07:00",
  "approved_by": "HUMAN-OPERATOR-001",
  "approved_at": "2026-07-23T00:45:00+07:00",
  "approval_ref": "docs/00-governance/signing/SIGNING-PASS-2.md#append-only-batch-2-signing-record--2026-07-23",
  "entries": []
}
